<Payload xmlns="http://javaops.ru"
         xmlns:xsi="http://www.w3.org/2001/XMLSchema-instance"
         xsi:schemaLocation="http://javaops.ru payload.xsd">
    <Projects>
        <Project name="topjava">
            <description>TopJava project</description>
            <Group name="topjava08" type="REGISTERING"/>
            <Group name="topjava09" type="REGISTERING"/>
            <Group name="topjava10" type="REGISTERING"/>

        </Project>
        <Project name="masterJava">
            <description>MasterJava project</description>
            <Group name="masterJava21" type="CURRENT"/>
        </Project>
    </Projects>
    <Cities>
        <City id="spb">Санкт-Петербург</City>
        <City id="kiv">Киев</City>
        <City id="mnsk">Минск</City>
    </Cities>
    <Users>
        <User flag="active" city="kiv" email="gmail@gmail.com">
            <fullName>Full Name</fullName>
        </User>
        <User flag="superuser" city="spb" email="admin@javaops.ru" groupRefs="topjava08 topjava10 masterJava21">
<!--            <email>admin@javaops.ru</email>-->
            <fullName>Admin</fullName>
        </User>
        <User flag="active" email="asdasd@DF.com" city="spb" groupRefs="masterJava21">
            <fullName>rnd user</fullName>
        </User>
        <User flag="deleted" city="spb" email="mail@yandex.ru">
<!--            <email>mail@yandex.ru</email>-->
            <fullName>Deleted</fullName>
        </User>
    </Users>
</Payload>